{
  "dcp_version": "2.0",
  "agent_id": "agent:research-bot-v2-001",
  "session_nonce": "a1b2c3d4e5f6a1b2c3d4e5f6a1b2c3d4e5f6a1b2c3d4e5f6a1b2c3d4e5f6a1b2",
  "human_id": "human:alice-abc-123",
  "commissioning_authority": "Acme AI Governance Board",
  "timestamp": "2026-01-15T09:00:00Z",
  "purpose": "Autonomous research assistant for scientific literature review and synthesis",
  "initial_capabilities": ["browse", "api_call", "email"],
  "risk_tier": "medium",
  "principal_binding_reference": "rpr:acme-binding-2026-001",
  "composite_sig": {
    "classical": { "alg": "ed25519", "kid": "a1b2c3d4e5f6a1b2c3d4e5f6a1b2c3d4", "sig_b64": "dGVzdHNpZzEyMzQ1Njc4OTAxMjM0NTY=" },
    "pq": { "alg": "ml-dsa-65", "kid": "d4e5f6a1b2c3d4e5f6a1b2c3d4e5f6a1", "sig_b64": "dGVzdHBxc2lnMTIzNDU2Nzg5MDEyMzQ1Ng==" },
    "binding": "pq_over_classical"
  }
}
